{
  "gtin": "7501124103279",
  "sku": "7501124103279",
  "linea": "Farma",
  "nombre_sistema": "PRAMIGEL 10 200 50 MG C 20 COMPR",
  "nombres_sistema_alternos": [],
  "titulo": "Pramigel 10 mg/200 mg/200 mg/50 mg 20 Comprimidos",
  "descripcion": "Descripción:\nPramigel es un medicamento en comprimidos de Carnot Laboratorios que combina metoclopramida, hidróxido de aluminio, hidróxido de magnesio y simeticona. Está indicado en gastritis agudas y crónicas, esofagitis por reflujo gastroesofágico, úlcera gastroduodenal, hernia hiatal, dispepsias, aerofagia y meteorismo, en niños y adultos. La caja contiene 20 comprimidos de administración oral.\n\nCaracterísticas:\n- Cuatro principios activos: metoclopramida, hidróxido de aluminio, hidróxido de magnesio y simeticona.\n- Comprimidos para administración por vía oral.\n- Caja con 20 comprimidos.\n- Medicamento de venta con receta médica.\n\nFórmula:\nCada comprimido contiene clorhidrato de metoclopramida 10 mg, gel de hidróxido de aluminio equivalente a 200 mg, hidróxido de magnesio 200 mg y simeticona 50 mg; excipientes cbp 1 comprimido.\n\nModo de uso:\nVía oral. Mayores de 12 años y adultos: 1 comprimido cada 8 horas. Niños de 6 a 12 años: medio comprimido cada 8 horas.\n\nPresentación:\nCaja con 20 comprimidos.\n\nAdvertencias:\nSu venta requiere receta médica. No se use en caso de hipersensibilidad a los componentes, sangrado gastrointestinal activo, oclusión intestinal, pancreatitis o apendicitis aguda, ni en insuficiencia renal o hepática. No se administre durante el primer ni el último trimestre del embarazo ni en la lactancia. Evite combinarlo con psicotrópicos, antihistamínicos o barbitúricos. Lea las instrucciones del empaque. Consulte a su médico. No se deje al alcance de los niños.",
  "ficha": {
    "marca": "Pramigel",
    "fabricante": "Productos Científicos (Carnot Laboratorios)",
    "presentacion": "Caja con comprimidos",
    "contenido_neto": 20,
    "unidad_contenido": "comprimidos",
    "unidades_por_envase": 20,
    "principio_activo": "Metoclopramida, hidróxido de aluminio, hidróxido de magnesio y simeticona",
    "concentracion": "10 mg/200 mg/200 mg/50 mg",
    "via_administracion": "Oral",
    "registro_sanitario": "87632 SSA IV",
    "otros": "Forma farmacéutica: Comprimido; Venta con receta médica"
  },
  "receta_mx": "Sí",
  "marketplaces": {
    "mercadolibre": {
      "categoria_id": "MLM457821",
      "categoria_ruta": "Salud y Equipamiento Médico > Cuidado de la Salud > Farmacia > Medicamentos de Venta Libre > Digestivos Venta Libre",
      "categoria_rx_sugerida": "MLM457828",
      "catalogo_id": "MLM40172230"
    },
    "amazon": {},
    "shopify": {},
    "odoo": {}
  },
  "imagenes": [
    {
      "archivo": "7501124103279_1.jpg",
      "origen": "tienda",
      "fuente_url": "https://production-media.fahorro.com/media/catalog/product/7/5/7501124103279.jpg",
      "pagina": "https://www.fahorro.com/pramigel-10-mg-200-mg-200-mg-oral-20-comprimidos.html",
      "ancho_original": 1600,
      "alto_original": 1600,
      "lado_final": 1625,
      "fecha": "2026-09-29",
      "lado_util": 1505
    },
    {
      "archivo": "7501124103279_2.jpg",
      "origen": "catalogo_ml",
      "fuente_url": "https://http2.mlstatic.com/D_NQ_NP_663317-MLA88129888817_072025-F.jpg",
      "pagina": "https://www.mercadolibre.com.mx/p/MLM40172230",
      "ancho_original": 993,
      "alto_original": 496,
      "lado_final": 974,
      "lado_util": 902,
      "fecha": "2026-09-29"
    }
  ],
  "url_oficial": "",
  "fuentes": [
    "https://www.medicamentosplm.com/home/productos/pramigel-comprimidos/35/101/9330/25",
    "https://www.fahorro.com/pramigel-10-mg-200-mg-200-mg-oral-20-comprimidos.html"
  ],
  "investigacion": {
    "estado": "verificado",
    "confianza": "alta",
    "encontrado_por": "gtin",
    "notas": "GTIN y presentación confirmados. Composición, indicaciones, dosis y contraindicaciones tomadas de la ficha PLM. El nombre del sistema abrevia '10/200/50'; la fórmula completa es 10/200/200/50 mg. Tiendas lo ubican entre los medicamentos con receta (metoclopramida).",
    "notas_imagenes": "1 foto de frente del empaque (tienda, 1625 px).",
    "fecha": "2026-09-29",
    "sesion": 3
  }
}