{
  "gtin": "7501537103422",
  "sku": "7501537103422",
  "linea": "Farma",
  "nombre_sistema": "TRIBEDOCE DX COMPLEJO B/LIDOCAINA/DEXAMETA SOL INYC C/3 AMP BRULUART",
  "nombres_sistema_alternos": [],
  "titulo": "Tribedoce DX Complejo B Dexametasona Lidocaína Inyectable",
  "descripcion": "Descripción:\nTribedoce DX es una solución inyectable de Bruluart que combina complejo B (tiamina, piridoxina y cianocobalamina) con lidocaína, un anestésico local, y dexametasona, un corticoesteroide. Es un medicamento de administración inyectable que debe prescribir y aplicar personal de salud. Cada caja incluye 3 ampolletas No. 1 de 1 ml, 3 ampolletas No. 2 de 2 ml y 3 jeringas desechables con aguja estéril.\n\nCaracterísticas:\n- Combinación de vitaminas B1, B6 y B12 con lidocaína y dexametasona.\n- Solución inyectable de dos ampolletas que se mezclan antes de aplicarse.\n- Incluye 3 jeringas desechables con aguja estéril.\n- Medicamento de venta con receta médica.\n\nComposición:\nPor dosis (mezcla de las ampolletas No. 1 y No. 2): tiamina (vitamina B1) 100 mg, piridoxina (vitamina B6) 100 mg, cianocobalamina (vitamina B12) 5 mg, dexametasona 4 mg y lidocaína 30 mg.\n\nModo de uso:\nLea el modo de empleo antes de su aplicación. Con jeringa y aguja esterilizada, extraiga primero el contenido de la ampolleta No. 1 y después el de la ampolleta No. 2. Agite. Hecha la mezcla en la misma jeringa, aplíquese de inmediato. No se administren las ampolletas No. 1 y No. 2 de manera individual. La dosis es la que indique su médico.\n\nPresentación:\nCaja con 3 ampolletas No. 1 de 1 ml, 3 ampolletas No. 2 de 2 ml y 3 jeringas desechables con aguja estéril.\n\nAdvertencias:\nSu venta requiere receta médica. No se use en caso de hipersensibilidad a los componentes. La dexametasona es un corticoesteroide: informe a su médico si tiene diabetes, hipertensión, enfermedad del corazón o de los riñones, o si está embarazada o en lactancia. Lea las instrucciones del empaque. Consulte a su médico. No se deje al alcance de los niños.",
  "ficha": {
    "marca": "Tribedoce DX",
    "fabricante": "Bruluart",
    "linea": "Tribedoce",
    "variante": "Complejo B con dexametasona y lidocaína",
    "presentacion": "Caja con ampolletas y jeringas",
    "contenido_neto": 3,
    "unidad_contenido": "dosis (3 ampolletas No. 1 de 1 ml y 3 No. 2 de 2 ml)",
    "unidades_por_envase": 3,
    "principio_activo": "Tiamina, piridoxina, cianocobalamina, dexametasona y lidocaína",
    "concentracion": "B1 100 mg; B6 100 mg; B12 5 mg; dexametasona 4 mg; lidocaína 30 mg por dosis",
    "via_administracion": "Parenteral (inyectable)",
    "registro_sanitario": "433M2002 SSA IV",
    "otros": "Forma farmacéutica: Solución inyectable; Incluye 3 jeringas desechables con aguja estéril; Venta con receta médica"
  },
  "receta_mx": "Sí",
  "marketplaces": {
    "mercadolibre": {
      "categoria_id": "MLM457812",
      "categoria_ruta": "Salud y Equipamiento Médico > Cuidado de la Salud > Farmacia > Medicamentos de Venta Libre > Sistema Nervioso Venta Libre",
      "categoria_rx_sugerida": "MLM457836",
      "catalogo_id": "MLM52362214"
    },
    "amazon": {},
    "shopify": {},
    "odoo": {}
  },
  "imagenes": [
    {
      "archivo": "7501537103422_2.jpg",
      "origen": "tienda",
      "fuente_url": "https://www.yza.mx/on/demandware.static/-/Sites-masterCatalog_YzaMexico/default/dw2c98b3ff/images/large/7501537103422_1.jpg",
      "pagina": "https://www.yza.mx/tribedoce-dx-3-amp/MXYZ_7501537103422.html",
      "ancho_original": 1200,
      "alto_original": 1200,
      "lado_final": 1237,
      "fecha": "2026-09-29",
      "lado_util": 1146
    },
    {
      "archivo": "7501537103422_3.jpg",
      "origen": "tienda",
      "fuente_url": "https://www.yza.mx/dw/image/v2/BDPM_PRD/on/demandware.static/-/Sites-masterCatalog_YzaMexico/default/dw72ead2a7/images/large/7501537103422_2.jpg?sw=1000&sh=1000",
      "pagina": "https://www.yza.mx/tribedoce-dx-3-amp/MXYZ_7501537103422.html",
      "ancho_original": 1000,
      "alto_original": 1000,
      "lado_final": 1018,
      "fecha": "2026-09-29",
      "lado_util": 942
    }
  ],
  "url_oficial": "",
  "fuentes": [
    "https://curitek.com/producto/tribedoce-dx-complejo-b-dexametasona-lidocaina/",
    "https://farmaciaherrera.com.mx/products/complejo-b-dexametasona-lidocaina-tribedoce-dx-solucion-inyectable-con-3-ampulas",
    "https://wecarepharma.mx/en/products/tribedoce-dx-2ml-con-3-ampulas-complejo-b-dexametasona-lidocaina"
  ],
  "investigacion": {
    "estado": "verificado",
    "confianza": "alta",
    "encontrado_por": "gtin",
    "notas": "GTIN y registro confirmados en el empaque (reverso). Las cantidades por dosis (B1 100, B6 100, B12 5, dexametasona 4, lidocaína 30 mg) vienen de una ficha de distribuidor y del nombre de otro listado; otra ficha decía lidocaína 20 mg. El empaque no las muestra legibles; verificar antes de publicar. No se encontraron indicaciones oficiales, por eso el texto no las lista.",
    "notas_imagenes": "2 fotos (tienda, 1237 y 1018 px): frente del empaque actual y reverso con modo de empleo y registro. Se descartaron una foto del empaque anterior con menos resolución, una copia duplicada y una con marca de agua de una tienda.",
    "fecha": "2026-09-29",
    "sesion": 3
  }
}