{
  "gtin": "7503003738404",
  "sku": "7503003738404",
  "linea": "Farma",
  "nombre_sistema": "ROSEL C24 CAPS 50 300MG AMANTADINA CLORFENAMINA PARACETAMOL WERMAR 128",
  "nombres_sistema_alternos": [],
  "titulo": "",
  "descripcion": "",
  "ficha": {},
  "receta_mx": "",
  "marketplaces": {
    "mercadolibre": {
      "categoria_id": "",
      "categoria_ruta": "",
      "categoria_rx_sugerida": "",
      "catalogo_id": ""
    },
    "amazon": {},
    "shopify": {},
    "odoo": {}
  },
  "imagenes": [],
  "url_oficial": "",
  "fuentes": [],
  "investigacion": {
    "estado": "pendiente",
    "confianza": "",
    "encontrado_por": "",
    "notas": "",
    "fecha": "2026-09-29"
  }
}