{
  "gtin": "7506484500430",
  "sku": "7506484500430",
  "linea": "Farma",
  "nombre_sistema": "CINTAPORE PIEL 1 25CM X 9 MTS C24 48",
  "nombres_sistema_alternos": [],
  "titulo": "Cinta Microporosa Cintapore Piel 1.25 cm x 9 m 24 Rollos",
  "descripcion": "Descripción:\nCinta adhesiva microporosa color piel de la marca Cintapore, en caja con 24 rollos de 1.25 cm (media pulgada) de ancho por 9 m de largo cada uno. Se utiliza en el cuidado de la salud y la curación para fijar gasas, apósitos y curaciones ligeras sobre la piel, y es de uso común en botiquines, consultorios y en el hogar.\n\nCaracterísticas:\n- Cinta microporosa de uso general que permite que la piel elimine la humedad.\n- Adhesivo hipoalergénico, de fácil remoción, que no deja residuos.\n- Libre de látex y suave con la piel.\n- Color piel, discreta al aplicarla.\n- Rollo delgado de 1.25 cm x 9 m, adecuado para fijaciones y vendajes pequeños.\n\nModo de uso:\nLimpie y seque la zona antes de aplicar. Corte el tramo necesario y colóquelo sobre el apósito o la gasa sin estirar la cinta en exceso. Para retirarla, despéguela lentamente para no lastimar la piel.\n\nPresentación:\nCaja con 24 rollos de cinta microporosa color piel de 1.25 cm x 9 m cada uno.\n\nAdvertencias:\n- Uso externo. No la aplique directamente sobre heridas abiertas ni sobre piel irritada o lesionada.\n- Si aparece enrojecimiento, comezón o irritación, suspenda su uso.\n- Manténgala fuera del alcance de los niños.",
  "ficha": {
    "marca": "Cintapore",
    "linea": "Cinta microporosa",
    "variante": "Color piel",
    "presentacion": "Caja con 24 rollos",
    "contenido_neto": 24,
    "unidad_contenido": "rollos",
    "unidades_por_envase": 24,
    "otros": "Ancho: 1.25 cm (1/2 pulgada); Largo por rollo: 9 m; Color: piel; Hipoalergénica; Libre de látex; Formato de venta: Caja con 24 rollos",
    "fabricante": "Codifarma"
  },
  "receta_mx": "No aplica",
  "marketplaces": {
    "mercadolibre": {
      "categoria_id": "MLM178504",
      "categoria_ruta": "Salud y Equipamiento Médico > Cuidado de la Salud > Farmacia > Vendas",
      "categoria_rx_sugerida": "",
      "catalogo_id": ""
    },
    "amazon": {},
    "shopify": {},
    "odoo": {}
  },
  "imagenes": [],
  "url_oficial": "",
  "fuentes": [
    "https://www.amazon.com.mx/cinta-micropore-pulgada-piezas-cintapore/dp/B089X8FMBJ",
    "https://www.farmalisto.com.mx/adhesivos/8137-comprar-cintapore-empaque-con-1-rollo-25cmx92m-color-blanco-material-de-curacion-precio.html"
  ],
  "investigacion": {
    "estado": "verificado",
    "confianza": "media",
    "encontrado_por": "nombre",
    "notas": "La búsqueda con el GTIN no devolvió ninguna ficha de Cintapore; solo micropore de 3M (caja C/24 de 1.25 cm) y listados de Mercado Libre y Amazon. La ficha de Amazon de la marca Cintapore (1 pulgada, C/12) menciona la línea 'Micropore 1/2 pulgada pack C/24', lo que corrobora la caja de 24 rollos de 1.25 cm; la marca se atribuye allí a 'Suanca', sin confirmar, por lo que no se anota fabricante. El '48' al final del nombre del sistema se ignoró (parece lote). Verificar con el empaque.",
    "notas_imagenes": "Sin fotos. Se buscó foto de Cintapore piel 1.25 cm (1/2 pulgada) x 9 m: Farmapronto solo tiene Cintapore piel 2.5 cm y la línea Plus (foto de 265 px, otra línea); iFarma lista Cintapore piel 1.25 cm x 10 m caja c/24 (GTIN 7506484500799, otra longitud) pero bloquea la descarga (Cloudflare); Dilopsan tiene 1.25 cm x 5 m (otra medida); Farmalisto pide captcha; el catálogo oficial de Mercado Libre no tiene Cintapore de 1.25 cm (solo el de 2.5 cm, GTIN 7506484500645). Las fotos de 3M Micropore y la de 2.5 cm no valen (otra marca/otra medida). Fabricante Codifarma según la ficha de Farmalisto de otro Cintapore.",
    "fecha": "2026-09-29",
    "sesion": 7
  }
}