{
  "gtin": "7501027514103",
  "sku": "7501027514103",
  "linea": "Mark",
  "nombre_sistema": "BIB EVENFLO ACUARIO 8 OZ",
  "nombres_sistema_alternos": [],
  "titulo": "",
  "descripcion": "",
  "ficha": {},
  "receta_mx": "",
  "marketplaces": {
    "mercadolibre": {
      "categoria_id": "",
      "categoria_ruta": "",
      "categoria_rx_sugerida": "",
      "catalogo_id": ""
    },
    "amazon": {},
    "shopify": {},
    "odoo": {}
  },
  "imagenes": [],
  "url_oficial": "",
  "fuentes": [],
  "investigacion": {
    "estado": "pendiente",
    "confianza": "",
    "encontrado_por": "",
    "notas": "",
    "fecha": "2026-09-29"
  }
}